{
  "schema": "hathq://hat/package/v2",
  "package_id": "hat/source-curator",
  "repository_id": "hat-source-curator",
  "version": "1.0.0",
  "specification_version": "1.0.0",
  "manifest": {
    "schema": "hathq://hat/manifest/v1",
    "id": "hat/source-curator",
    "name": "Source Curator",
    "version": "1.0.0",
    "capabilities": [
      "source-evaluation",
      "evidence-summarization"
    ],
    "decision_boundaries": [
      "recommend-source-acceptance"
    ],
    "input_classifications": [
      "public",
      "internal"
    ],
    "output_classification": "internal",
    "permissions": [
      {
        "resource": "knowledge-source",
        "operations": [
          "inspect-metadata",
          "propose-classification"
        ],
        "mode": "propose"
      }
    ]
  },
  "operations": [
    {
      "id": "hathq://vocabulary/action/review-source/v1",
      "input_schema": "hathq://hat-source-curator/review-source-input/v1",
      "output_schema": "hathq://hat-source-curator/review-source-output/v1",
      "context_plan": {
        "id": "review-source-context",
        "selectors": [
          {
            "namespace": "knowledge-source",
            "projection_schema": "hathq://hat-source-curator/knowledge-source/v1",
            "required": true
          }
        ],
        "unresolved_policy": "record-unresolved"
      },
      "reducer": {
        "id": "review-source-reducer",
        "strategy": "typed-domain-event",
        "event_schema": "hathq://hat-source-curator/review-source-event/v1",
        "projection_schema": "hathq://hat-source-curator/review-source-projection/v1",
        "conflict_policy": "reject"
      },
      "procedure": {
        "id": "review-source-procedure",
        "steps": [
          {
            "action_id": "hathq://vocabulary/action/review-source/v1",
            "input_schema": "hathq://hat-source-curator/review-source-input/v1",
            "output_schema": "hathq://hat-source-curator/review-source-output/v1"
          }
        ]
      },
      "handler": {
        "kind": "declarative-hat",
        "reference": "review-source-procedure"
      }
    }
  ],
  "catalog": {
    "schema": "hathq://hat/semantic-catalog/v1",
    "identity": {
      "catalog_id": "hat-source-curator",
      "version": 1,
      "digest_sha256": "5f4fd04b970039a1b5d937b6d38d7b87a30fc4ae723a557f8ff3ad8ae8c8f97b"
    },
    "owner_repository_id": "hat-source-curator",
    "foundation": false,
    "dependencies": [
      {
        "catalog_id": "hathq.foundation",
        "version": 1,
        "digest_sha256": "7ed387a86fe00a320784c181a2128da856ccb3e5e3930040ca39d9f5b627a465"
      }
    ],
    "incompatibilities": [],
    "terms": [
      {
        "reference": {
          "catalog_id": "hat-source-curator",
          "catalog_digest_sha256": "5f4fd04b970039a1b5d937b6d38d7b87a30fc4ae723a557f8ff3ad8ae8c8f97b",
          "term_id": "hathq://vocabulary/entity/knowledge-source/v1",
          "version": 1,
          "definition_digest_sha256": "294cee0ebc8d80779bed3e62090bb9ed170afad96cd9bbcba8c48c0271946da4",
          "kind": "entity-type"
        },
        "wire_schema": "hathq://hat-source-curator/knowledge-source/v1",
        "semantic_icon": "source",
        "dependencies": [],
        "is_a": [],
        "domain": [],
        "range": []
      },
      {
        "reference": {
          "catalog_id": "hat-source-curator",
          "catalog_digest_sha256": "5f4fd04b970039a1b5d937b6d38d7b87a30fc4ae723a557f8ff3ad8ae8c8f97b",
          "term_id": "hathq://vocabulary/action/review-source/v1",
          "version": 1,
          "definition_digest_sha256": "506c2d1ee32cbb6a51437b7381f31472033ce5f87ea613bfe92918ebbd9498df",
          "kind": "action"
        },
        "wire_schema": "hathq://hat-source-curator/review-source-input/v1",
        "semantic_icon": "action",
        "dependencies": [],
        "is_a": [],
        "domain": [],
        "range": []
      }
    ],
    "lexicalizations": []
  }
}
